{"run":52,"commit":"c21b976+wip","metric":20.00,"metrics":{"aw_n_ok":4,"aw_n_total":20,"aw_success_rate":20.00,"successes":"ClockStopWatchRunning,MarkorCreateFolder,MarkorDeleteNote,RecipeDeleteSingleRecipe","lost_vs_r51":"OpenAppTaskEval","new_wins":"MarkorCreateFolder,MarkorDeleteNote","base_model":"unsloth/gemma-4-E4B-it-unsloth-bnb-4bit","adapter":"r51","mode":"a11y+vision_inference_only","retrained":false,"harness_fix_answer_guard":true},"status":"keep","description":"r52 VISION ON at eval time — same r51 LoRA + harness fix for answer guard (relaxed open_app+click → any successful action). New agent m3a_gemma4_lora_a11y_vision (M3AA11Y harness with text_only=False so wrapper passes screenshots). NO RETRAINING — tests Gemma 4 E4B's pretrained multimodal capability against text-trained adapter. AW-20 = 4/20 = 20.0% — NEW PROJECT HIGH (was 15% across r48 and r51). Vision uplifted MarkorCreateFolder and MarkorDeleteNote (both NEW WINS — never succeeded before across r19-r51). LOST OpenAppTaskEval which had been a perennial winner (vision distraction on simple permission-grant screen). Net +1 task. CONFIRMS: text-only training was a major ceiling. Even pretrained-vision-only at inference with text-trained adapter delivers +5 points. Path forward: r53 = RETRAIN with vision (proper multimodal training, screenshots in train data) — should unlock more wins by aligning train/eval distribution. Also: AW-116 with r52 to verify the AW-20 lift generalizes.","timestamp":1777772200,"segment":3}
{"run":"52-aw116","commit":"c21b976+wip","metric":8.62,"metrics":{"aw_n_ok":10,"aw_n_total":116,"aw_n_attempted":107,"aw_emulator_stuck":true,"successes":"CameraTakeVideo,ClockStopWatchRunning,MarkorCreateFolder,MarkorDeleteNote,OpenAppTaskEval,RecipeDeleteMultipleRecipesWithConstraint,RecipeDeleteSingleRecipe,RecipeDeleteSingleWithRecipeWithNoise,SystemBluetoothTurnOffVerify,SystemBrightnessMinVerify"},"status":"keep","description":"r52 VISION-INFERENCE AW-116 = 10/116 ≈ 8.6% (estimate). Emulator hung at task 104 (a11y tree fetch failure after WiFi-off task). 107 tasks attempted, 10 successful. Beats r48 text-only (9/116=7.76%) by +1 task. Vision unlocked: MarkorCreateFolder, MarkorDeleteNote, RecipeDeleteSingleWithRecipeWithNoise, SystemBrightnessMinVerify (4 new wins). Lost vs r48: SystemBluetoothTurnOnVerify, SystemBrightnessMaxVerify, SystemWifiTurnOffVerify+On (4 Settings tasks where vision distracted). Net +0/116 directly but +1 if WiFi tasks completed. KEY INSIGHT: AW-20 reading of 20% (4/20) = bias from Markor/Recipe-heavy slice where vision helps most; AW-116 has many Settings + QA tasks where vision adds noise. Vision-inference-only with TEXT-trained LoRA = modest uplift (~+1 task) but not the +5 AW-20 suggested. r53 vision-trained LoRA (now with vision-tower-frozen fix) would learn to USE vision properly and may exceed r52. Next: retry r53 with frozen vision tower fix, then AW-116.","timestamp":1777809000,"segment":3}
{"run":"53-blocked","commit":"c21b976+wip","metric":0.00,"metrics":{"train_loss":"NaN","attempts":4,"attn":"sdpa+eager","lr":"2e-4_to_2e-5","vision_tower":"frozen","projector":"frozen"},"status":"crash","description":"r53 vision retrain BLOCKED. 4 attempts: r53a (default config) NaN; r53b (frozen vision tower) NaN; r53c (lr=2e-5) NaN on first step; r53d (eager attention) NaN. Loss is NaN on FIRST forward pass before any gradient updates → numerical issue in Gemma-4 multimodal SFT pipeline (Unsloth FastVisionModel + bf16 + 226-row image dataset). Fix would require deeper Unsloth/Gemma-4 internals work beyond autoresearch scope. Best result remains r52 vision-inference: 20% AW-20, 8.6% AW-116. Path forward (next session): (a) downgrade Unsloth/transformers versions to a known-working multimodal SFT combo, (b) switch to non-Unsloth multimodal training (raw HF + accelerate), (c) try Qwen2.5-VL-3B which has more stable Unsloth support per recent docs, or (d) commit to r52 inference-only path and squeeze more from r51 LoRA + better data quality.","timestamp":1777810000,"segment":3}
{"run":55,"commit":"c21b976+wip","metric":0.00,"metrics":{"train_loss":"NaN","reason":"overfit_collapse_at_epoch_10"},"status":"crash","description":"r55 train r51 data with MAX_STEPS=800 (2x r51's 400). Loss healthy through epoch 5 (step 400, loss ~0.26), collapsed to NaN at epoch 10 (step 660+). Overfit + numerical instability after 10 passes through 241-row dataset. r51 recipe at 400 steps is at the edge of stability — doubling steps pushes over. CONCLUSION on Gemma-4-Unsloth path: we have hit the ceiling. r48 (text-only, 7.76% AW-116) and r52 (vision inference, 8.62% AW-116) are the project records. Multimodal SFT, longer training, vision-teacher data — all blocked by NaN/instability bugs in current Unsloth+Gemma-4 stack. To break past 10% AW-116: switch model framework (Qwen2.5-VL-3B with proper Unsloth support, or InternVL2.5-4B per OS-Genesis recipe), OR build env-side RFT loop (filter teacher trajectories by env-verified success).","timestamp":1777813500,"segment":3}
{"run":"57b","commit":"c21b976+wip","metric":0.00,"metrics":{"aw_n_total":0,"aw_emulator_dead":true,"ac_full_match":23.00,"ac_type_match":53.50,"ac_parse_pct":99.50,"ac_type_match_click":63.41,"ac_type_match_input_text":65.00,"ac_type_match_open_app":100.00,"ac_type_match_scroll":13.33,"ac_type_match_wait":10.53,"al_full_match":3.59,"al_type_match":33.07,"al_parse_pct":99.60,"al_type_match_click":46.00,"al_type_match_input_text":38.00,"al_type_match_status":16.00,"train_loss_final":0.1481,"base_model":"unsloth/Qwen3.5-4B"},"status":"keep","description":"r57b — switched base model to Qwen3.5-4B (text-only, ~4B). Same r51 train data (241 rows, drop-poison + answer-synth). Fixed train_smoke.py to use ChatML markers (<|im_start|>user/assistant) instead of Gemma's <|turn>. Train loss 0.148 (vs Gemma r48 0.73). AC offline 23.0/53.5 (matches/beats r48 22.0/56.5). open_app=100 (perfect, matches Gemma best). AL full=3.59 (between r48 2.39 and r51 4.78), AL type=33.07 (BEST yet, vs r48 26.29), al_status=16 (vs r48 2 — Qwen learned status emission much better). AW-20 BLOCKED — emulator dead since r52 wifi-off task; needs manual restart. Implication: Qwen3.5-4B is at LEAST as good as Gemma E4B on offline metrics, with BETTER status emission. Likely AW-20 will see uplift over Gemma if emulator restored.","timestamp":1777819000,"segment":3}
{"run":"58","commit":"c21b976+wip","metric":0.00,"metrics":{"ac_full_match":0.00,"ac_type_match":0.00,"ac_parse_pct":29.00,"train_loss_final":0.2108,"base_model":"Qwen/Qwen2.5-VL-3B-Instruct"},"status":"discard","description":"r58 — Qwen2.5-VL-3B-Instruct text-only on r51 data. Train clean (loss 0.21 in 7min, fastest yet). EVAL BROKEN: AC=0/0, parse=29%. Sample preds: model outputs free-form conversational text (eBay shopping advice, Q&A reformulations) instead of Reason/Action JSON. Same eval pipeline worked for Qwen3.5-4B (r57b 23/53.5) so issue is specific to Qwen2.5-VL — likely the vision-aware chat template injects image placeholders even in text-only mode, confusing generation. Would need separate eval pathway for Qwen-VL models. DISCARD. r57b Qwen3.5-4B remains the strongest non-Gemma adapter.","timestamp":1777820000,"segment":3}
{"run":"59","commit":"c21b976+wip","metric":0.00,"metrics":{"error":"UnslothVisionDataCollator_rejects_text_only_model"},"status":"crash","description":"r59 — Qwen3-4B (text-only base, no vision tower). Train pipeline uses UnslothVisionDataCollator which raises TypeError on non-vision models. Would need FastLanguageModel pathway in train_smoke.py for true text-only models. r57b Qwen3.5-4B works because it has vision capability even when used in text-only mode.","timestamp":1777820500,"segment":3}
{"run":"60","commit":"c21b976+wip","metric":0.00,"metrics":{"error":"trl_DataCollatorForCompletionOnlyLM_not_available"},"status":"crash","description":"r60 attempt to enable text-only Qwen3-4B via trl collator fallback. Failed: trl in this venv doesn't export DataCollatorForCompletionOnlyLM. Would need different collator or version bump. STOPPING text-only Qwen variants — r57b Qwen3.5-4B works fine and waiting on emulator restart for AW-20.","timestamp":1777821000,"segment":3}
{"run":56,"commit":"c21b976+wip","metric":15.00,"metrics":{"aw_n_ok":3,"aw_n_total":20,"aw_success_rate":15.00,"successes":"ClockStopWatchPausedVerify(NEW),ClockStopWatchRunning,RecipeDeleteSingleRecipe","ac_full_match":22.00,"ac_type_match":53.50,"ac_parse_pct":99.00,"ac_type_match_open_app":83.33,"ac_type_match_input_text":70.00,"ac_type_match_scroll":46.67,"al_full_match":3.59,"al_type_match":28.69,"al_status_type_match":6.00,"train_loss_final":0.3997,"base_model":"unsloth/gemma-4-E4B-it-unsloth-bnb-4bit","data":"r51 (231 + 10 answer)","max_steps":600},"status":"keep","description":"r56 — Gemma E4B + r51 data + 600 steps (vs r51's 400). Train loss 0.40 (vs r51 0.57). AC offline 22/53.5 (matches r48). AL 3.59/28.69 (matches r51, status=6 vs r51's 12). AW-20 = 3/20 = 15% — ties r48 and r51. KEY: NEW WIN on ClockStopWatchPausedVerify (never succeeded before in any run since r19!). Lost OpenAppTaskEval (perennial winner) — overfit on Clock at expense of simple permission tap. Net: same metric but different task profile. Suggests longer training trades simple-task wins for harder-task wins. Worth AW-116 to see if Clock-Pause generalizes (more Clock tasks in full bench).","timestamp":1777823000,"segment":3}
{"run":"56-aw116","commit":"c21b976+wip","metric":7.76,"metrics":{"aw_n_ok":9,"aw_n_total":116,"aw_success_rate":7.76,"successes":"ClockStopWatchRunning,OpenAppTaskEval,RecipeDeleteMultipleRecipesWithConstraint,RecipeDeleteSingleRecipe,SystemBluetoothTurnOn,SystemBluetoothTurnOnVerify,SystemBrightnessMaxVerify,SystemWifiTurnOffVerify,SystemWifiTurnOnVerify"},"status":"info","description":"r56 AW-116 = 9/116 = 7.76% — exact tie with r48 baseline. r56's 600-step training (vs r51's 400) doesn't generalize. Same task count but DIFFERENT profile vs r48: r56 GAINED SystemBluetoothTurnOn (NEW for r56), kept the perennial Settings + Recipe wins; LOST CameraTakeVideo (r48 had this). Net: same 9/116 metric. r48 vs r56 vs r52: 7.76, 7.76, 8.6% — r52 vision-inference still the project record. Confirms longer text-only training is at ceiling.","timestamp":1777825000,"segment":3}
{"run":"57b-aw20","commit":"c21b976+wip","metric":20.00,"metrics":{"aw_n_ok":4,"aw_n_total":20,"aw_success_rate":20.00,"successes":"ClockStopWatchRunning,MarkorDeleteNote,OpenAppTaskEval,RecipeDeleteSingleRecipe","ac_full_match":23.00,"ac_type_match":53.50,"al_full_match":3.59,"al_type_match":33.07,"al_status_type_match":16.00,"train_loss_final":0.1481,"base_model":"unsloth/Qwen3.5-4B"},"status":"keep","description":"r57b Qwen3.5-4B AW-20 = 4/20 = 20.0% — TIES r52 vision-inference Gemma. Different success profile: ClockStopWatchRunning, MarkorDeleteNote, OpenAppTaskEval, RecipeDeleteSingleRecipe. r52 Gemma vision had Clock/Markor/Recipe wins x4 too but with MarkorCreateFolder instead of OpenAppTaskEval. Qwen3.5-4B with TEXT-ONLY training matches Gemma+vision-inference. Wrapper compatibility: existing m3a_gemma4_lora_a11y agent works with Qwen via --gemma4_model_id flag (FastVisionModel handles both). Project AW-20 high stays at 20%. Next: AW-116 with r57b — if Qwen offline metrics (best AL type/status) generalize, could push past 8.6% AW-116 record.","timestamp":1777828000,"segment":3}
{"run":"57b-aw116","commit":"c21b976+wip","metric":6.90,"metrics":{"aw_n_ok":8,"aw_n_total":116,"aw_n_attempted":113,"aw_emulator_stuck":true,"successes":"ClockStopWatchRunning,ContactsAddContact(NEW),ContactsNewContactDraft(NEW),MarkorDeleteNote,OpenAppTaskEval,RecipeDeleteSingleRecipe,SystemBrightnessMaxVerify,TurnOnWifiAndOpenApp(NEW)","ac_full_match":23.00,"al_full_match":3.59,"al_status_type_match":16.00,"base_model":"unsloth/Qwen3.5-4B"},"status":"info","description":"r57b Qwen3.5-4B AW-116 = 8/116 = 6.90%. Emulator wedged at task 114 on VLC playlist (same hang as r52 AW-116). Project AW-116 best remains r52 vision-inference Gemma at 8.62%. KEY FINDING: Qwen offers DIFFERENT task profile vs Gemma — gained 3 NEW tasks never solved by Gemma (ContactsAddContact, ContactsNewContactDraft, TurnOnWifiAndOpenApp), lost 4 (Bluetooth/Brightness/Wifi Settings tasks Gemma had). Contacts wins are particularly valuable: no Gemma run across r19-r56 ever solved Contacts tasks. Net same total but different capabilities — suggests ENSEMBLE Gemma+Qwen could combine wins. Or RFT with Qwen as student would compound on Contacts/SimpleApp wins. AW-20 reading of 20% was misleading: AW-116 final is below Gemma's 8.62%.","timestamp":1777832000,"segment":3}
{"run": "62", "metric": null, "metrics": {"train_loss_final": 0.3321, "train_rows": 107, "epochs": 2.0, "max_steps": 54, "base_adapter": "outputs/r57b/checkpoint-final"}, "status": "trained_pending_eval", "description": "r62 low-epoch Genesis vision continuation from r57b after r61 overfit/catastrophic-forgetting early AW-116 0/15. Fixes: epoch-based steps, no blank image placeholders, adapter continuation.", "timestamp": 1777957444, "segment": 4}
{"run": "62-aw20", "metric": 15.0, "metrics": {"aw_n_ok": 3, "aw_n_total": 20, "aw_success_rate": 15.0, "successes": "MarkorCreateFolder,OpenAppTaskEval,RecipeDeleteSingleRecipe", "base_adapter": "outputs/r57b/checkpoint-final", "adapter": "outputs/r62_qwen35_r57b_plus_genesis_vision_e2/checkpoint-final"}, "status": "discard", "description": "r62 low-epoch Genesis vision continuation AW-20 = 3/20. Recovered from r61 collapse but under r57b 4/20; no clear vision benefit. Do not run AW-116.", "timestamp": 1777958860, "segment": 4}
{"commit": "wip", "description": "r62 Qwen3.5 r57b+Genesis low-epoch vision continuation. AW-116=10/115=8.70% attempted (116 records, 1 exceptions). Successes: ContactsNewContactDraft, MarkorCreateFolder, OpenAppTaskEval, RecipeDeleteMultipleRecipesWithConstraint, RecipeDeleteSingleRecipe, SimpleCalendarDeleteOneEvent, SystemBrightnessMaxVerify, SystemBrightnessMinVerify, SystemWifiTurnOnVerify, TurnOnWifiAndOpenApp.", "metric": 8.7, "metrics": {"adapter": "/home/sanskar/Documents/Github/cs5661-final/outputs/r62_qwen35_r57b_plus_genesis_vision_e2/checkpoint-final", "aw_exceptions": 1, "aw_n_attempted": 115, "aw_n_ok": 10, "aw_n_total": 116, "aw_success_rate": 8.7, "base_adapter": "/home/sanskar/Documents/Github/cs5661-final/outputs/r57b/checkpoint-final", "base_model": "unsloth/Qwen3.5-4B", "dataset": "data/pathZ/genesis_vision_rebuild/train.expanded.jsonl", "epochs": 2.0, "rows_json": "/home/sanskar/Documents/Github/cs5661-final/outputs/androidworld_logs/r62_qwen35_vision_cont_aw116.rows.json", "rows_md": "/home/sanskar/Documents/Github/cs5661-final/outputs/androidworld_logs/r62_qwen35_vision_cont_aw116.rows.md", "run_dir": "/home/sanskar/android_world/runs/r62_qwen35_vision_cont_aw116/run_20260505T011652695623", "run_exit": 0, "successes": "ContactsNewContactDraft,MarkorCreateFolder,OpenAppTaskEval,RecipeDeleteMultipleRecipesWithConstraint,RecipeDeleteSingleRecipe,SimpleCalendarDeleteOneEvent,SystemBrightnessMaxVerify,SystemBrightnessMinVerify,SystemWifiTurnOnVerify,TurnOnWifiAndOpenApp", "train_loss_final": 0.3321, "train_rows": 107, "vision_training": true}, "run": "62-aw116", "segment": 4, "status": "keep", "timestamp": 1777975799}
