{"type":"config","name":"pathZ-sft-smoke","metricName":"full_match","metricUnit":"%","bestDirection":"higher"}
{"run":1,"commit":"ce09f38","metric":20.00,"metrics":{"type_match":51.50,"parse_pct":92.50,"reason_pct":94.50,"train_loss_final":null},"status":"keep","description":"baseline: zero-shot Gemma 4 E2B on M3A-format eval","timestamp":1777615570,"segment":0}
{"run":2,"commit":"ce09f38","metric":18.50,"metrics":{"type_match":44.00,"parse_pct":78.50,"reason_pct":83.00,"train_loss_final":1.0801},"status":"discard","description":"200-step QLoRA, lr=2e-4, projector on; max_new=128 truncates verbose reasons before Action: line","timestamp":1777616676,"segment":0}
{"type":"config","name":"pathZ-sft-smoke","metricName":"full_match","metricUnit":"%","bestDirection":"higher"}
{"run":3,"commit":"ce09f38","metric":20.50,"metrics":{"type_match":54.50,"parse_pct":100.00,"reason_pct":100.00,"train_loss_final":null},"status":"keep","description":"baseline at max_new_tokens=384 (segment 1 floor)","timestamp":1777617065,"segment":1}
{"run":4,"commit":"12e0490","metric":18.50,"metrics":{"type_match":54.50,"parse_pct":98.50,"reason_pct":98.50,"train_loss_final":1.0801},"status":"discard","description":"200-step QLoRA at max_new=384; format OK but open_app/navigate_back regressed","timestamp":1777618332,"segment":1}
{"run":5,"commit":"12e0490","metric":13.50,"metrics":{"type_match":48.50,"parse_pct":99.50,"reason_pct":100.00,"train_loss_final":0.7420},"status":"discard","description":"500-step QLoRA, lr=2e-4: catastrophic class-collapse (click 67% of preds, input_text/navigate_back→click)","timestamp":1777619943,"segment":1}
{"run":6,"commit":"e41a94c","metric":22.00,"metrics":{"type_match":50.00,"parse_pct":98.50,"reason_pct":98.50,"train_loss_final":0.9552},"status":"keep","description":"300-step QLoRA on balanced data (250/cls × 6 cls); +1.5pp vs baseline","timestamp":1777620988,"segment":1}
{"run":7,"commit":"9051e7c","metric":21.50,"metrics":{"type_match":53.50,"parse_pct":99.00,"reason_pct":99.00,"train_loss_final":0.7556},"status":"discard","description":"500-step QLoRA on balanced data; click recovered (66.7) but wait/open_app eroded","timestamp":1777622429,"segment":1}
{"run":8,"commit":"9051e7c","metric":20.50,"metrics":{"type_match":54.50,"parse_pct":99.00,"reason_pct":98.50,"train_loss_final":1.1233},"status":"discard","description":"300-step QLoRA balanced @ lr=1e-4; under-trained, ties baseline","timestamp":1777623593,"segment":1}
{"run":9,"commit":"9051e7c","metric":22.00,"metrics":{"type_match":57.00,"parse_pct":98.00,"reason_pct":98.00,"train_loss_final":0.8371},"status":"discard","description":"300-step balanced + schema-anchored Reason; ties run 6 on full but type_match 50→57; open_app crashed 92→42 (app_name-in-Reason coupling)","timestamp":1777624837,"segment":1}
{"run":10,"commit":"9051e7c","metric":20.00,"metrics":{"type_match":46.00,"parse_pct":99.00,"reason_pct":99.50,"train_loss_final":0.7851},"status":"discard","description":"300-step balanced + schema-anchored Reason w/ open_app decoupled; input_text crashed 65→10","timestamp":1777625872,"segment":1}
{"run":11,"commit":"9051e7c","metric":17.50,"metrics":{"type_match":56.00,"parse_pct":99.50,"reason_pct":100.00,"train_loss_final":0.9528},"status":"discard","description":"300-step balanced + projector OFF; click type up 56→75 but full and minorities regress","timestamp":1777626805,"segment":1}
{"run":12,"commit":"9051e7c","metric":20.00,"metrics":{"type_match":58.50,"parse_pct":98.00,"reason_pct":99.00,"train_loss_final":0.9498},"status":"discard","description":"run-6 recipe at seed=2024: full=20.00 vs run-6 22.00; ±2pp seed noise on 200-row eval","timestamp":1777627690,"segment":1}
{"type":"config","name":"pathZ-sft-smoke","metricName":"full_match","metricUnit":"%","bestDirection":"higher"}
{"run":13,"commit":"9051e7c","metric":20.80,"metrics":{"type_match":55.00,"parse_pct":99.60,"reason_pct":100.00,"train_loss_final":null},"status":"keep","description":"baseline @ 500-row eval (segment 2 floor)","timestamp":1777628587,"segment":2}
{"run":14,"commit":"9051e7c","metric":22.20,"metrics":{"type_match":54.20,"parse_pct":99.00,"reason_pct":99.00,"train_loss_final":0.9539},"status":"keep","description":"run-6 recipe @ 500-row eval; +1.4pp confirmed; scroll +23.7, open_app +25.8","timestamp":1777630283,"segment":2}
{"run":15,"commit":"dea04e6","metric":21.80,"metrics":{"type_match":57.40,"parse_pct":100.00,"reason_pct":100.00,"train_loss_final":0.8434},"status":"discard","description":"400/cls × 6 = 2400 rows + 400 steps; scroll +19 input_text +5 but open_app/navigate_back regressed","timestamp":1777631920,"segment":2}
{"run":16,"commit":"dea04e6","metric":23.40,"metrics":{"type_match":52.80,"parse_pct":98.80,"reason_pct":98.80,"train_loss_final":0.8742},"status":"keep","description":"lora_r=32, alpha=64 at run-14 base; new best, +2.6 vs baseline","timestamp":1777633391,"segment":2}
{"run":17,"commit":"b18d9a0","metric":20.00,"metrics":{"type_match":50.20,"parse_pct":97.80,"reason_pct":97.80,"train_loss_final":0.7679},"status":"discard","description":"lora_r=32 + 400 steps; over-balanced — scroll/input_text gain but click loses 11pp","timestamp":1777635020,"segment":2}
{"run":18,"commit":"73a20ec","metric":21.20,"metrics":{"type_match":54.20,"parse_pct":98.80,"reason_pct":98.80,"train_loss_final":0.9306},"status":"discard","description":"lora_r=32 + 250 steps AC-only; -2.2pp vs r=32@300 best; confirms 300-step needed at higher r","timestamp":1777643000,"segment":2}
{"type":"config","name":"pathZ-sft-smoke","metricName":"aw_success_rate","metricUnit":"%","bestDirection":"higher"}
{"run":19,"commit":"2590f55","metric":20.00,"metrics":{"aw_n_ok":2,"aw_n_total":10,"ac_full_match":19.40,"ac_type_match":48.00,"ac_parse_pct":99.40,"al_full_match":5.58,"al_type_match":34.26,"al_parse_pct":98.80,"train_loss_final":0.8526},"status":"keep","description":"AC+AL mixed train (1000 AC + 500 AL, 250×6 cls) @ run-16 recipe; AW SR 20% (+20pp vs baseline) — first positive AW signal","timestamp":1777647500,"segment":3}
{"run":20,"commit":"2590f55","metric":0.00,"metrics":{"aw_n_ok":0,"aw_n_total":10,"ac_full_match":null,"ac_type_match":null,"ac_parse_pct":null,"al_full_match":null,"al_type_match":null,"al_parse_pct":null,"train_loss_final":null},"status":"keep","description":"M3A baseline (no LoRA) on the same 10-task AW slice — segment-3 floor","timestamp":1777648500,"segment":3}
{"run":21,"commit":"2590f55","metric":10.00,"metrics":{"aw_n_ok":1,"aw_n_total":10,"ac_full_match":16.00,"ac_type_match":53.40,"ac_parse_pct":95.80,"al_full_match":5.98,"al_type_match":42.23,"al_parse_pct":97.61,"al_status_type_match":0.00,"train_loss_final":0.8253},"status":"discard","description":"+status class (250 rows from AL); status type-match still 0% but other classes disrupted; -10pp vs r19","timestamp":1777656500,"segment":3}
{"run":22,"commit":"057dd31","metric":50.00,"metrics":{"aw_n_ok":5,"aw_n_total":10,"ac_full_match":19.60,"ac_type_match":51.00,"ac_parse_pct":99.40,"al_full_match":1.99,"al_type_match":35.06,"al_parse_pct":100.00,"al_status_type_match":0.00,"train_loss_final":0.7262},"status":"keep","description":"r19 mix + 400 steps; AW SR 50% (+30pp vs r19) — NEW BEST; ClockStopWatchRunning + RecipeDeleteSingleRecipe new wins","timestamp":1777663800,"segment":3}
{"run":23,"commit":"057dd31","metric":30.00,"metrics":{"aw_n_ok":3,"aw_n_total":10,"ac_full_match":21.20,"ac_type_match":51.80,"ac_parse_pct":97.60,"al_full_match":3.59,"al_type_match":37.05,"al_parse_pct":98.80,"al_status_type_match":0.00,"train_loss_final":0.6330},"status":"discard","description":"r22 + 500 steps; over-trains, input_text crashes 19→5 on AC; lost OpenApp+Recipe wins from r22; -20pp","timestamp":1777670000,"segment":3}
{"run":24,"commit":"057dd31","metric":30.00,"metrics":{"aw_n_ok":3,"aw_n_total":10,"ac_full_match":18.40,"ac_type_match":46.80,"ac_parse_pct":99.60,"al_full_match":3.59,"al_type_match":36.25,"al_parse_pct":100.00,"al_status_type_match":0.00,"train_loss_final":0.7202},"status":"discard","description":"r22 + 350/cls (2100 rows, 0.76 epoch); under-trained — lost CameraTakePhoto + RecipeDeleteSingleRecipe vs r22; -20pp","timestamp":1777677000,"segment":3}
{"run":25,"commit":"057dd31","metric":20.00,"metrics":{"aw_n_ok":2,"aw_n_total":10,"ac_full_match":17.20,"ac_type_match":51.20,"ac_parse_pct":100.00,"al_full_match":3.19,"al_type_match":39.84,"al_parse_pct":100.00,"al_status_type_match":0.00,"train_loss_final":0.6181},"status":"discard","description":"r22 + 350/cls + 525 steps (1.0 epoch); lost both Clock tasks vs r22; -30pp; over-trained or over-balanced","timestamp":1777683500,"segment":3}
{"run":26,"commit":"057dd31","metric":10.00,"metrics":{"aw_n_ok":1,"aw_n_total":10,"ac_full_match":16.20,"ac_type_match":36.40,"ac_parse_pct":99.20,"al_full_match":4.38,"al_type_match":27.49,"al_parse_pct":98.80,"al_status_type_match":0.00,"train_loss_final":0.7506},"status":"discard","description":"r22 verbatim + seed=2024 (reproducibility test); 10% vs r22's 50% — REVEALS HUGE SEED VARIANCE on 10-task eval (~±20pp SD)","timestamp":1777686500,"segment":3}
{"run":27,"commit":"057dd31","metric":10.00,"metrics":{"aw_n_ok":1,"aw_n_total":10,"ac_full_match":20.00,"ac_type_match":58.80,"ac_parse_pct":100.00,"al_full_match":5.98,"al_type_match":47.81,"al_parse_pct":100.00,"al_status_type_match":0.00,"train_loss_final":0.7633},"status":"discard","description":"PURE-AL ablation (1000 rows × 4 cls, no AC, 268 steps); 10% AW SR; killed OpenAppTaskEval (no open_app in AL data) — confirms AC mixing is load-bearing for AW","timestamp":1777689500,"segment":3}
{"run":28,"commit":"8a3e4b8","metric":20.00,"metrics":{"aw_n_ok":2,"aw_n_total":10,"ac_full_match":21.80,"ac_type_match":56.20,"ac_parse_pct":100.00,"al_full_match":5.58,"al_type_match":41.83,"al_parse_pct":100.00,"al_status_type_match":0.00,"train_loss_final":0.7307},"status":"discard","description":"r22 verbatim + seed=4242 (3rd variance sample); 20% AW SR. Three-sample r22-recipe distribution: 50/10/20 → mean=26.7%, σ≈21pp. Confirms r22 was upward outlier; recipe true mean ~20-30%","timestamp":1777669376,"segment":3}
{"run":29,"commit":"a86c85f","metric":0.00,"metrics":{"aw_n_ok":0,"aw_n_total":20,"ac_full_match":21.00,"ac_type_match":55.80,"ac_parse_pct":99.80,"al_full_match":4.38,"al_type_match":37.85,"al_parse_pct":100.00,"al_status_type_match":0.00,"train_loss_final":0.7132,"ac_type_match_input_text":0.00,"ac_type_match_open_app":93.94},"status":"discard","description":"r22 verbatim (default seed=3407) on 20-task slice → 0/20 = 0%. Same recipe/seed/data as r22 (md5 confirmed identical). 4-sample r22-recipe distribution: 50/10/20/0 → mean=20%, σ≈21pp; CUDA non-determinism makes seed-fixed reruns diverge wildly. AC input_text COLLAPSED to 0% (was 37.5% in r22) — recipe is genuinely seed-fragile, not just slice-noisy","timestamp":1777672694,"segment":3}
{"run":30,"commit":"a86c85f+wip","metric":0.00,"metrics":{"aw_n_ok":null,"aw_n_total":null,"ac_full_match":14.20,"ac_type_match":43.40,"ac_parse_pct":99.20,"ac_type_match_input_text":2.33,"ac_type_match_click":53.59,"ac_type_match_scroll":30.51,"ac_type_match_open_app":87.10,"al_full_match":null,"al_type_match":null,"train_loss_final":0.7115},"status":"discard","description":"input_text x2 boost (500 rows) + 460 steps. AC offline DROPPED to 14.20% (-6.8 vs r29) — boost diluted click/scroll/navigate_back; input_text only moved 0→2.33%. Cancelled before AW. Conclusion: more input_text rows do NOT fix the structural emission problem. Pivoting to pure-a11y for r31","timestamp":1777674393,"segment":3}
{"run":31,"commit":"a86c85f+wip","metric":10.00,"metrics":{"aw_n_ok":2,"aw_n_total":20,"ac_full_match":18.60,"ac_type_match":44.60,"ac_parse_pct":99.80,"ac_type_match_input_text":4.65,"ac_type_match_open_app":96.77,"ac_type_match_navigate_back":0.00,"al_full_match":3.59,"al_type_match":26.69,"al_parse_pct":100.00,"al_status_type_match":2.00,"train_loss_final":0.7074},"status":"keep","description":"Pure-a11y AC-only (1500 rows, 400 steps, max_length=16384, no images) + new M3AA11Y harness (app inventory, deterministic history, executor feedback, no-op detection). 2/20 = 10% AW SR (ClockStopWatchRunning + OpenAppTaskEval). open_app=96.77 (highest yet); pure-a11y emitted status=2% on AL despite no status training. First pure-a11y data point","timestamp":1777678184,"segment":3}
{"run":32,"commit":"a86c85f+wip","metric":5.00,"metrics":{"aw_n_ok":1,"aw_n_total":20,"ac_full_match":18.60,"ac_type_match":44.60,"ac_parse_pct":99.80,"ac_type_match_input_text":4.65,"ac_type_match_open_app":96.77,"ac_type_match_navigate_back":0.00,"al_full_match":3.59,"al_type_match":26.69,"al_parse_pct":100.00,"al_status_type_match":2.00,"train_loss_final":0.7074},"status":"discard","description":"Same r31 adapter + M3AA11Y harness PATCHES (no-op widening to scroll/input_text, status guard refusing complete on no-change, answer guard requiring open_app+click first, tolerant JSON parser, max_new_tokens 256→384). 1/20 = 5% AW SR — only OpenAppTaskEval succeeded; ClockStopWatchRunning regressed. Within σ≈7pp of r31's 10% but below best. Harness patches alone do NOT lift SR; variance dominates. Confirms scaffolding cannot compensate for unchanged adapter","timestamp":1777679355,"segment":3}
{"run":33,"commit":"b096ce4+wip","metric":10.00,"metrics":{"aw_n_ok":2,"aw_n_total":20,"ac_full_match":9.50,"ac_type_match":23.00,"ac_parse_pct":99.00,"ac_type_match_input_text":25.00,"ac_type_match_open_app":91.67,"ac_type_match_click":24.39,"ac_type_match_scroll":0.00,"ac_type_match_wait":0.00,"ac_type_match_navigate_back":0.00,"al_full_match":1.99,"al_type_match":25.10,"al_parse_pct":100.00,"al_type_match_click":53.00,"al_type_match_input_text":4.00,"al_type_match_scroll":16.00,"al_status_type_match":0.00,"train_loss_final":0.7179},"status":"discard","description":"Schema parity retrain (--harness-parity flag): AC training rows now emit indexed app inventory + det-history Step format matching M3AA11Y eval prompt. Same recipe as r31 (1500 AC-only rows, --text-only, max_length=16384, 400 steps). 2/20 = 10% AW SR — IDENTICAL tasks to r31 (ClockStopWatchRunning + OpenAppTaskEval). Schema parity was format-neutral, NOT load-bearing. Offline AC type_match COLLAPSED 44.6→23.0 but input_text type_match SURGED 4.65→25.00 — model rebalanced action distribution toward AW-relevant verbs (click/input_text/open_app dominant; scroll/wait/navigate_back collapsed). Net AW result unchanged. Confirms hypothesis: harness investments + adapter alone cannot lift past r31 ceiling. Base model at capacity ceiling on (state,action) imitation. Pivoting to teacher distillation","timestamp":1777682157,"segment":3}
{"run":34,"commit":"b096ce4+wip","metric":0.00,"metrics":{"aw_n_ok":null,"aw_n_total":null,"ac_full_match":null,"ac_type_match":null,"ac_parse_pct":null,"al_full_match":null,"al_type_match":null,"al_parse_pct":null,"train_loss_final":null,"distill_match_rate":10.13,"distill_salvage_rate":22.80,"distill_keep_rate":32.93,"distill_n_kept":494,"distill_n_total":1500},"status":"discard","description":"Teacher distillation (Gemma 4 31B 4-bit) on 1500 harness-parity AC rows. INVALIDATED PRE-TRAIN by data analysis: (1) 96% of AC open_app rows target non-AW-inventory apps (Amazon/Khan Academy/Maps/Gmail/eBay/Vimeo etc., none in the harness 19-app set); (2) 281/329 erroneous teacher status emits were correct infeasibility refusals; (3) salvage step would force student to learn post-hoc rationalizations of actions teacher itself refused. Teacher fails on same classes as student (scroll 11%, navigate_back 2%, wait 3%, input_text 0% full-match) due to shared text-only-prompt deficiencies. Conclusion: data+harness problem, not model capacity. No student trained, no AW eval. Pivoting to r35 = rebuild train data with AW-app filter on AC + re-include AL","timestamp":1777689138,"segment":3}
{"run":35,"commit":"56002a5+wip","metric":10.00,"metrics":{"aw_n_ok":2,"aw_n_total":20,"ac_full_match":12.00,"ac_type_match":40.50,"ac_parse_pct":100.00,"ac_type_match_click":54.47,"ac_type_match_input_text":10.00,"ac_type_match_open_app":91.67,"ac_type_match_scroll":6.67,"ac_type_match_wait":0.00,"ac_type_match_navigate_back":0.00,"al_full_match":1.20,"al_type_match":37.85,"al_parse_pct":100.00,"al_type_match_click":92.00,"al_type_match_input_text":0.00,"al_type_match_scroll":6.00,"al_status_type_match":0.00,"train_loss_final":0.6231}, "status":"discard","description":"r35 AW-distribution data rebuild: AC filtered to AW-inventory open_app only (4727 dropped), 250 synth open_app rows per AW app (4750 total), 50/50 AC/AL mix for shared classes, AL-only for status. 1750 rows balanced. Same recipe + harness as r33 (text-only, harness-parity, 400 steps). 2/20=10% AW SR — IDENTICAL tasks to r31/r33 (ClockStopWatchRunning + OpenAppTaskEval). Data fix did NOT change deployment behavior. Diagnosis: M3AA11Y eval prompt already prepends AW app inventory, which constrained model to AW apps regardless of what it learned to call in training. Contamination was real but not load-bearing for AW SR. AC offline DROPPED full=12.00 (vs r33=9.50; both crashed by AC val containing same off-distribution open_app rows model now correctly avoids). AL type_match SURGED 25→37 driven by click 53→92 (AL data integration). Bottleneck is harness context (per user), not data distribution. Pivoting r36 to reason-preserving history in M3AA11Y","timestamp":1777692429,"segment":3}
{"run":36,"commit":"b4d87b8+wip","metric":5.00,"metrics":{"aw_n_ok":1,"aw_n_total":20,"ac_full_match":12.00,"ac_type_match":40.50,"ac_parse_pct":100.00,"al_full_match":1.20,"al_type_match":37.85,"al_parse_pct":100.00,"train_loss_final":0.6231},"status":"discard","description":"r36 reason-preserving history (harness-only, r35 adapter unchanged): m3a_a11y appended each prior step model `Reason:` text on a second `  reason:` line in the history block. ONLY r35 adapter unchanged. 1/20 = 5% AW SR — LOST ClockStopWatchRunning (which had succeeded in r31/r33/r35). OpenAppTaskEval still works. Diagnosis: prompt distribution shift — model was trained on history WITHOUT reasons, adding them at eval time confuses it (likely interprets prior reasons as part of the user goal, or the extra ~240char/step text dilutes attention budget on relevant elements). User-hypothesized harness-context lever EXISTS but adding raw signal naively is net-negative. Either need to retrain with reasons in history (aligns distribution; ~30-40min) OR pick a different harness change that does NOT shift prompt distribution. Pivoting r37 to candidate-action shortlist header (additive, doesnt restructure history; simpler distribution shift)","timestamp":1777693510,"segment":3}
{"run":37,"commit":"328c176+wip","metric":5.00,"metrics":{"aw_n_ok":1,"aw_n_total":20,"ac_full_match":11.00,"ac_type_match":27.00,"ac_parse_pct":100.00,"ac_type_match_click":29.27,"ac_type_match_input_text":25.00,"ac_type_match_open_app":91.67,"ac_type_match_scroll":6.67,"ac_type_match_wait":5.26,"ac_type_match_navigate_back":0.00,"al_full_match":1.20,"al_type_match":33.86,"al_parse_pct":100.00,"al_type_match_click":85.00,"al_type_match_input_text":0.00,"al_type_match_scroll":0.00,"al_status_type_match":0.00,"train_loss_final":0.6110},"status":"discard","description":"r37 retrained WITH reasons-in-history (--history-reasons in prepare_smoke_data; new --history-reasons flag emits `  reason: <synthetic>` line under each prior `Step N:` in train prompts). M3AA11Y harness updated to mirror format (carries action_reason text through history). 1750 rows v3 train, same recipe as r35. 1/20 = 5% AW SR — IDENTICAL FAILURE as r36 (lost ClockStopWatchRunning, only OpenAppTaskEval succeeds). Critical: matching train+eval distribution did NOT fix the regression. RULES OUT prompt-distribution-shift as the cause of r36 failure. Real cause: model uses prior reasons as distraction signal, gets stuck looping (max_steps on trivial 1-button task). Cannot distinguish own-prior-reason from user goal; tries to re-execute the action instead of terminating. AC type_match dropped 40→27 (eval data lacks history-reasons → mild distribution mismatch in opposite direction). Reverting r37 changes; pivoting r38 to compact a11y tree (drop empty-label elements at both train+eval; addresses prompt-budget hypothesis directly without touching history)","timestamp":1777695677,"segment":3}
